{"id": "spatial_mapper", "name": "Spatial mapper", "version": "1.0.0", "category": "mesh", "icon": "⌖",
 "description": "Top view of the body and every puck. Owners drag pucks to their physical positions for spatial focus.",
 "entry": "module.js", "default_size": "l", "sizes": ["m", "l", "xl"], "uses": ["nodes", "status"]}
