{"id": "session", "name": "Guided session", "version": "1.0.0", "category": "session", "icon": "▶",
 "description": "Choose a target state, audio mode and modalities, then start a closed-loop session guided by the AI.",
 "entry": "module.js", "default_size": "m", "sizes": ["m", "l"], "uses": ["status"]}
