{"id": "manual_override", "name": "Manual override", "version": "1.0.0", "category": "session", "icon": "⚙",
 "description": "Send geometric parameters directly. Pauses the Guide for 30 s. Fade-all-out is always available.",
 "entry": "module.js", "default_size": "m", "sizes": ["m", "l"], "uses": []}
