{"id": "guide_log", "name": "Guide rationale", "version": "1.0.0", "category": "insight", "icon": "✎",
 "description": "Every decision the AI Guide makes, in plain language: pacing, leading, resistance and support.",
 "entry": "module.js", "default_size": "l", "sizes": ["m", "l", "xl"], "uses": ["events"]}
