{"id": "hub_accounts", "name": "Hub accounts", "version": "1.0.0", "category": "system", "icon": "⚿",
 "description": "Who has signed in to this cocoon hub, with their cocoon role. Visible to hub owners only.",
 "entry": "module.js", "default_size": "l", "sizes": ["m", "l", "xl"], "requires_role": "owner", "uses": []}
